{
  "version": "1.0",
  "name": "Baseline (generated from legacy engagement.js)",
  "tiers": { "low": 1, "medium": 1, "high": 1 },
  "cells": {
    "thaad": {
      "arash_2": { "pk": 0, "shots": 0 },
      "dji_fpv": { "pk": 0, "shots": 0 },
      "geran_2": { "pk": 0, "shots": 0 },
      "samad_3": { "pk": 0, "shots": 0 },
      "shahed_101": { "pk": 0, "shots": 0 },
      "shahed_129": { "pk": 0, "shots": 0 },
      "shahed_136": { "pk": 0, "shots": 0 },
      "shahed_238": { "pk": 0, "shots": 0 },
      "geran_4": { "pk": 0, "shots": 0 },
      "geran_5": { "pk": 0, "shots": 0 },
      "abu_mahdi": { "pk": 0, "shots": 0 },
      "fateh_110": { "pk": 1, "shots": 2 },
      "ghadr": { "pk": 1, "shots": 1 },
      "haj_qasem": { "pk": 1, "shots": 1 },
      "khalij_e_fars": { "pk": 1, "shots": 2 },
      "khorramshahr": { "pk": 1, "shots": 1 },
      "paveh_quds": { "pk": 0, "shots": 0 },
      "qaem_1": { "pk": 1, "shots": 2 },
      "shahab_3": { "pk": 1, "shots": 1 },
      "soumar": { "pk": 0, "shots": 0 },
      "zulfagher": { "pk": 1, "shots": 2 },
      "zulfagher_e_basir": { "pk": 1, "shots": 2 }
    },
    "arrow": {
      "arash_2": { "pk": 0, "shots": 0 },
      "dji_fpv": { "pk": 0, "shots": 0 },
      "geran_2": { "pk": 0, "shots": 0 },
      "samad_3": { "pk": 0, "shots": 0 },
      "shahed_101": { "pk": 0, "shots": 0 },
      "shahed_129": { "pk": 0, "shots": 0 },
      "shahed_136": { "pk": 0, "shots": 0 },
      "shahed_238": { "pk": 0, "shots": 0 },
      "geran_4": { "pk": 0, "shots": 0 },
      "geran_5": { "pk": 0, "shots": 0 },
      "abu_mahdi": { "pk": 0, "shots": 0 },
      "fateh_110": { "pk": 1, "shots": 1 },
      "ghadr": { "pk": 1, "shots": 1 },
      "haj_qasem": { "pk": 1, "shots": 1 },
      "khalij_e_fars": { "pk": 1, "shots": 1 },
      "khorramshahr": { "pk": 1, "shots": 1 },
      "paveh_quds": { "pk": 0, "shots": 0 },
      "qaem_1": { "pk": 1, "shots": 1 },
      "shahab_3": { "pk": 1, "shots": 1 },
      "soumar": { "pk": 0, "shots": 0 },
      "zulfagher": { "pk": 1, "shots": 1 },
      "zulfagher_e_basir": { "pk": 1, "shots": 1 }
    },
    "aegis_sm3": {
      "arash_2": { "pk": 0, "shots": 0 },
      "dji_fpv": { "pk": 0, "shots": 0 },
      "geran_2": { "pk": 0, "shots": 0 },
      "samad_3": { "pk": 0, "shots": 0 },
      "shahed_101": { "pk": 0, "shots": 0 },
      "shahed_129": { "pk": 0, "shots": 0 },
      "shahed_136": { "pk": 0, "shots": 0 },
      "shahed_238": { "pk": 0, "shots": 0 },
      "geran_4": { "pk": 0, "shots": 0 },
      "geran_5": { "pk": 0, "shots": 0 },
      "abu_mahdi": { "pk": 0, "shots": 0 },
      "fateh_110": { "pk": 1, "shots": 1 },
      "ghadr": { "pk": 1, "shots": 1 },
      "haj_qasem": { "pk": 1, "shots": 1 },
      "khalij_e_fars": { "pk": 1, "shots": 1 },
      "khorramshahr": { "pk": 1, "shots": 1 },
      "paveh_quds": { "pk": 0, "shots": 0 },
      "qaem_1": { "pk": 1, "shots": 1 },
      "shahab_3": { "pk": 1, "shots": 1 },
      "soumar": { "pk": 0, "shots": 0 },
      "zulfagher": { "pk": 1, "shots": 1 },
      "zulfagher_e_basir": { "pk": 1, "shots": 1 }
    },
    "patriot": {
      "arash_2": { "pk": 0.4687, "shots": 3 },
      "dji_fpv": { "pk": 0.4687, "shots": 3 },
      "geran_2": { "pk": 0.4687, "shots": 3 },
      "samad_3": { "pk": 0.4687, "shots": 3 },
      "shahed_101": { "pk": 0.4687, "shots": 3 },
      "shahed_129": { "pk": 0.4687, "shots": 3 },
      "shahed_136": { "pk": 0.4687, "shots": 3 },
      "shahed_238": { "pk": 0.4687, "shots": 3 },
      "geran_4": { "pk": 0.4687, "shots": 3 },
      "geran_5": { "pk": 0.4687, "shots": 3 },
      "abu_mahdi": { "pk": 0.6127, "shots": 2 },
      "fateh_110": { "pk": 0.6127, "shots": 2 },
      "ghadr": { "pk": 0.6127, "shots": 2 },
      "haj_qasem": { "pk": 0.6127, "shots": 2 },
      "khalij_e_fars": { "pk": 0.6127, "shots": 2 },
      "khorramshahr": { "pk": 0.6127, "shots": 2 },
      "paveh_quds": { "pk": 0.6127, "shots": 2 },
      "qaem_1": { "pk": 0.6127, "shots": 2 },
      "shahab_3": { "pk": 0.6127, "shots": 2 },
      "soumar": { "pk": 0.6127, "shots": 2 },
      "zulfagher": { "pk": 0.6127, "shots": 2 },
      "zulfagher_e_basir": { "pk": 0.6127, "shots": 2 }
    },
    "davids_sling": {
      "arash_2": { "pk": 0.4687, "shots": 3 },
      "dji_fpv": { "pk": 0.4687, "shots": 3 },
      "geran_2": { "pk": 0.4687, "shots": 3 },
      "samad_3": { "pk": 0.4687, "shots": 3 },
      "shahed_101": { "pk": 0.4687, "shots": 3 },
      "shahed_129": { "pk": 0.4687, "shots": 3 },
      "shahed_136": { "pk": 0.4687, "shots": 3 },
      "shahed_238": { "pk": 0.4687, "shots": 3 },
      "geran_4": { "pk": 0.4687, "shots": 3 },
      "geran_5": { "pk": 0.4687, "shots": 3 },
      "abu_mahdi": { "pk": 0.6127, "shots": 2 },
      "fateh_110": { "pk": 0.6127, "shots": 2 },
      "ghadr": { "pk": 0.6127, "shots": 2 },
      "haj_qasem": { "pk": 0.6127, "shots": 2 },
      "khalij_e_fars": { "pk": 0.6127, "shots": 2 },
      "khorramshahr": { "pk": 0.6127, "shots": 2 },
      "paveh_quds": { "pk": 0.6127, "shots": 2 },
      "qaem_1": { "pk": 0.6127, "shots": 2 },
      "shahab_3": { "pk": 0.6127, "shots": 2 },
      "soumar": { "pk": 0.6127, "shots": 2 },
      "zulfagher": { "pk": 0.6127, "shots": 2 },
      "zulfagher_e_basir": { "pk": 0.6127, "shots": 2 }
    },
    "cheongung2": {
      "arash_2": { "pk": 0.4687, "shots": 3 },
      "dji_fpv": { "pk": 0.4687, "shots": 3 },
      "geran_2": { "pk": 0.4687, "shots": 3 },
      "samad_3": { "pk": 0.4687, "shots": 3 },
      "shahed_101": { "pk": 0.4687, "shots": 3 },
      "shahed_129": { "pk": 0.4687, "shots": 3 },
      "shahed_136": { "pk": 0.4687, "shots": 3 },
      "shahed_238": { "pk": 0.4687, "shots": 3 },
      "geran_4": { "pk": 0.4687, "shots": 3 },
      "geran_5": { "pk": 0.4687, "shots": 3 },
      "abu_mahdi": { "pk": 0.6127, "shots": 2 },
      "fateh_110": { "pk": 0.6127, "shots": 2 },
      "ghadr": { "pk": 0.6127, "shots": 2 },
      "haj_qasem": { "pk": 0.6127, "shots": 2 },
      "khalij_e_fars": { "pk": 0.6127, "shots": 2 },
      "khorramshahr": { "pk": 0.6127, "shots": 2 },
      "paveh_quds": { "pk": 0.6127, "shots": 2 },
      "qaem_1": { "pk": 0.6127, "shots": 2 },
      "shahab_3": { "pk": 0.6127, "shots": 2 },
      "soumar": { "pk": 0.6127, "shots": 2 },
      "zulfagher": { "pk": 0.6127, "shots": 2 },
      "zulfagher_e_basir": { "pk": 0.6127, "shots": 2 }
    },
    "aegis_sm2": {
      "arash_2": { "pk": 1, "shots": 1 },
      "dji_fpv": { "pk": 1, "shots": 1 },
      "geran_2": { "pk": 1, "shots": 1 },
      "samad_3": { "pk": 1, "shots": 1 },
      "shahed_101": { "pk": 1, "shots": 1 },
      "shahed_129": { "pk": 1, "shots": 1 },
      "shahed_136": { "pk": 1, "shots": 1 },
      "shahed_238": { "pk": 1, "shots": 1 },
      "geran_4": { "pk": 1, "shots": 1 },
      "geran_5": { "pk": 1, "shots": 1 },
      "abu_mahdi": { "pk": 1, "shots": 1 },
      "fateh_110": { "pk": 0, "shots": 0 },
      "ghadr": { "pk": 0, "shots": 0 },
      "haj_qasem": { "pk": 0, "shots": 0 },
      "khalij_e_fars": { "pk": 0, "shots": 0 },
      "khorramshahr": { "pk": 0, "shots": 0 },
      "paveh_quds": { "pk": 1, "shots": 1 },
      "qaem_1": { "pk": 0, "shots": 0 },
      "shahab_3": { "pk": 0, "shots": 0 },
      "soumar": { "pk": 1, "shots": 1 },
      "zulfagher": { "pk": 0, "shots": 0 },
      "zulfagher_e_basir": { "pk": 0, "shots": 0 }
    },
    "aegis_sm6": {
      "arash_2": { "pk": 1, "shots": 1 },
      "dji_fpv": { "pk": 1, "shots": 1 },
      "geran_2": { "pk": 1, "shots": 1 },
      "samad_3": { "pk": 1, "shots": 1 },
      "shahed_101": { "pk": 1, "shots": 1 },
      "shahed_129": { "pk": 1, "shots": 1 },
      "shahed_136": { "pk": 1, "shots": 1 },
      "shahed_238": { "pk": 1, "shots": 1 },
      "geran_4": { "pk": 1, "shots": 1 },
      "geran_5": { "pk": 1, "shots": 1 },
      "abu_mahdi": { "pk": 1, "shots": 1 },
      "fateh_110": { "pk": 1, "shots": 1 },
      "ghadr": { "pk": 1, "shots": 1 },
      "haj_qasem": { "pk": 1, "shots": 1 },
      "khalij_e_fars": { "pk": 1, "shots": 1 },
      "khorramshahr": { "pk": 1, "shots": 1 },
      "paveh_quds": { "pk": 1, "shots": 1 },
      "qaem_1": { "pk": 1, "shots": 1 },
      "shahab_3": { "pk": 1, "shots": 1 },
      "soumar": { "pk": 1, "shots": 1 },
      "zulfagher": { "pk": 1, "shots": 1 },
      "zulfagher_e_basir": { "pk": 1, "shots": 1 }
    },
    "iron_dome": {
      "arash_2": { "pk": 0.4687, "shots": 3 },
      "dji_fpv": { "pk": 0.4687, "shots": 3 },
      "geran_2": { "pk": 0.4687, "shots": 3 },
      "samad_3": { "pk": 0.4687, "shots": 3 },
      "shahed_101": { "pk": 0.4687, "shots": 3 },
      "shahed_129": { "pk": 0.4687, "shots": 3 },
      "shahed_136": { "pk": 0.4687, "shots": 3 },
      "shahed_238": { "pk": 0.4687, "shots": 3 },
      "geran_4": { "pk": 0.4687, "shots": 3 },
      "geran_5": { "pk": 0.4687, "shots": 3 },
      "abu_mahdi": { "pk": 0.4687, "shots": 3 },
      "fateh_110": { "pk": 0, "shots": 0 },
      "ghadr": { "pk": 0, "shots": 0 },
      "haj_qasem": { "pk": 0, "shots": 0 },
      "khalij_e_fars": { "pk": 0, "shots": 0 },
      "khorramshahr": { "pk": 0, "shots": 0 },
      "paveh_quds": { "pk": 0.4687, "shots": 3 },
      "qaem_1": { "pk": 0, "shots": 0 },
      "shahab_3": { "pk": 0, "shots": 0 },
      "soumar": { "pk": 0.4687, "shots": 3 },
      "zulfagher": { "pk": 0, "shots": 0 },
      "zulfagher_e_basir": { "pk": 0, "shots": 0 }
    },
    "nasams": {
      "arash_2": { "pk": 0.6127, "shots": 2 },
      "dji_fpv": { "pk": 0.6127, "shots": 2 },
      "geran_2": { "pk": 0.6127, "shots": 2 },
      "samad_3": { "pk": 0.6127, "shots": 2 },
      "shahed_101": { "pk": 0.6127, "shots": 2 },
      "shahed_129": { "pk": 0.6127, "shots": 2 },
      "shahed_136": { "pk": 0.6127, "shots": 2 },
      "shahed_238": { "pk": 0.6127, "shots": 2 },
      "geran_4": { "pk": 0.6127, "shots": 2 },
      "geran_5": { "pk": 0.6127, "shots": 2 },
      "abu_mahdi": { "pk": 0.6127, "shots": 2 },